id,area,type,category,description,status,priority,progress,businessValueScore,roiProjection,costEstimate,maturityLevel_level,maturityLevel_score,maturityLevel_description,applicability_type,applicability_description,applicability_weight,implementationPhase,businessJustification,consequences_immediate,consequences_type,consequences_impact,assignee,dueDate,lastUpdated,cafPrinciple,cafPrinciple2,nisReference
BR-F1,Business,Functional,Network Architecture & Design,Implement network segmentation to isolate OT networks from IT networks and external threats.,On Hold,Critical,6,2.4,54,183195,Managed,4,Measured and controlled,Essential,Critical for operations,1,Phase 1 (0-6 months),This network architecture & design supports regulatory compliance and operational security. Mapped to B4: System security. Addresses NIS Regulation 10(2)(a) - Appropriate measures to prevent and minimise impact.,Regulatory exposure,Security,Severe,Compliance Team,22/12/2025,06/06/2025,B4: System security,< - Blank | Not Applicable - >,NIS Regulation 10(2)(a) - Appropriate measures to prevent and minimise impact
BR-F2,Business,Functional,Secure Data Flow,Establish secure communication channels between different network segments while maintaining operational efficiency.,Not Started,Critical,71,4.9,251,182371,Developing,2,Some processes defined,Essential,Critical for operations,1,Future (24+ months),This secure data flow supports regulatory compliance and operational security. Mapped to B3: Data security. Addresses NIS Regulation 10(2)(b) - Appropriate measures to ensure service continuity.,Compliance gap,Compliance,Moderate,Identity Team,10/02/2026,06/06/2025,B3: Data security,B4: System security,NIS Regulation 10(2)(b) - Appropriate measures to ensure service continuity
BR-F3,Business,Functional,Access Control & Authentication,Implement access controls to restrict unauthorised lateral movement within the OT network.,Not Started,Critical,38,3.5,57,239154,Initial,1,"Ad-hoc, no formal process",Not Applicable,Not relevant to current scope,,Phase 2 (6-12 months),This access control & authentication supports regulatory compliance and operational security. Mapped to B3: Data security. Addresses NIS Regulation 10(2)(a) - Prevent unauthorised access.,Compliance gap,Operational,Significant,Compliance Team,06/09/2025,06/06/2025,B3: Data security,< - Blank | Not Applicable - >,NIS Regulation 10(2)(a) - Prevent unauthorised access
BR-F4,Business,Functional,Monitoring & Detection,Enable comprehensive monitoring and logging capabilities to detect and respond to potential security incidents within the OT environment.,Under Review,Medium,25,4,152,132885,Defined,3,Documented and standardized,Applicable,Relevant and beneficial,0.8,Phase 2 (6-12 months),This monitoring & detection supports regulatory compliance and operational security. Mapped to C1: Security monitoring. Addresses NIS Regulation 10(2)(c) - Appropriate measures to detect incidents.,Security vulnerability,Financial,Minor,Operations Team,07/10/2025,06/06/2025,C1: Security monitoring,C2: Proactive security event discovery,NIS Regulation 10(2)(c) - Appropriate measures to detect incidents
BR-F5,Business,Functional,Device & Firmware Management,Provide mechanisms to securely manage and update OT devices and systems without compromising network segmentation.,In Progress,Low,10,1.7,137,370311,Managed,4,Measured and controlled,Essential,Critical for operations,1,Phase 1 (0-6 months),This device & firmware management supports regulatory compliance and operational security. Mapped to A3: Asset management. Addresses NIS Regulation 10(2)(d) - Maintaining security through lifecycle management.,Operational risk,Security,Significant,Operations Team,07/04/2026,06/06/2025,A3: Asset management,B4: System security,NIS Regulation 10(2)(d) - Maintaining security through lifecycle management
BR-F6,Business,Functional,Remote Access,Implement a secure remote access solution for authorized personnel to access OT systems when necessary.,Not Started,Low,50,3.6,80,354999,Developing,2,Some processes defined,Essential,Critical for operations,1,Future (24+ months),This remote access supports regulatory compliance and operational security. Mapped to B2: Identity and access control. Addresses NIS Regulation 10(2)(a) - Secure access controls.,Regulatory exposure,Financial,Significant,Compliance Team,07/03/2026,06/06/2025,B2: Identity and access control,B4: System security,NIS Regulation 10(2)(a) - Secure access controls
BR-F7,Business,Functional,Network Architecture & Design,Establish a demilitarized zone (DMZ) to securely interface between OT and IT networks where required.,Completed,Critical,30,4.2,216,492013,Developing,2,Some processes defined,Essential,Critical for operations,1,Phase 2 (6-12 months),This network architecture & design supports regulatory compliance and operational security. Mapped to B4: System security. Addresses NIS Regulation 10(2)(a) - Appropriate technical measures.,Security vulnerability,Operational,Severe,Identity Team,03/12/2025,06/06/2025,B4: System security,< - Blank | Not Applicable - >,NIS Regulation 10(2)(a) - Appropriate technical measures
BR-F8,Business,Functional,Secure Data Flow,Implement data flow controls to regulate and monitor the movement of data between network segments.,On Hold,High,38,4.3,216,505923,Managed,4,Measured and controlled,Essential,Critical for operations,1,Phase 2 (6-12 months),This secure data flow supports regulatory compliance and operational security. Mapped to B3: Data security. Addresses NIS Regulation 10(2)(a) - Data flow protection.,Operational risk,Compliance,Severe,Compliance Team,16/02/2026,06/06/2025,B3: Data security,< - Blank | Not Applicable - >,NIS Regulation 10(2)(a) - Data flow protection
BR-F9,Business,Functional,Incident Response,Provide the capability to isolate compromised systems quickly to prevent the spread of potential threats.,On Hold,Medium,7,2.6,46,487431,Initial,1,"Ad-hoc, no formal process",Applicable,Relevant and beneficial,0.8,Phase 2 (6-12 months),This incident response supports regulatory compliance and operational security. Mapped to < - Blank | Not Applicable - >.,Security vulnerability,Financial,Significant,Network Team,22/02/2026,06/06/2025,< - Blank | Not Applicable - >,< - Blank | Not Applicable - >,
BR-F10,Business,Functional,Access Control & Authentication,Implement network-level authentication for all devices connecting to the OT network.,Not Started,Low,44,2.4,244,21740,Initial,1,"Ad-hoc, no formal process",Future,Planned for future phases,0.6,Phase 3 (12-24 months),This access control & authentication supports regulatory compliance and operational security. Mapped to < - Blank | Not Applicable - >.,Operational risk,Operational,Significant,Network Team,16/06/2025,06/06/2025,< - Blank | Not Applicable - >,< - Blank | Not Applicable - >,
BR-F11,Business,Functional,Integration Capabilities,Enable secure integration of cloud services and IoT devices with the OT network where necessary.,Completed,Critical,55,1.8,148,495260,Managed,4,Measured and controlled,Applicable,Relevant and beneficial,0.8,Phase 2 (6-12 months),This integration capabilities supports regulatory compliance and operational security. Mapped to < - Blank | Not Applicable - >.,Compliance gap,Financial,Significant,Compliance Team,02/04/2026,06/06/2025,< - Blank | Not Applicable - >,< - Blank | Not Applicable - >,
BR-F12,Business,Functional,Device & Firmware Management,Implement protocol-specific security measures for industrial control system (ICS) protocols.,Under Review,Medium,75,2.3,138,448475,Managed,4,Measured and controlled,Applicable,Relevant and beneficial,0.8,Phase 2 (6-12 months),This device & firmware management supports regulatory compliance and operational security. Mapped to < - Blank | Not Applicable - >.,Regulatory exposure,Security,Moderate,Compliance Team,04/04/2026,06/06/2025,< - Blank | Not Applicable - >,< - Blank | Not Applicable - >,
BR-F13,Business,Functional,Backup & Recovery,Provide mechanisms for secure data backup and recovery across segmented networks.,Under Review,Critical,23,4.6,92,315079,Optimizing,5,Continuously improving,Conditional,Depends on other factors,0.4,Phase 2 (6-12 months),This backup & recovery supports regulatory compliance and operational security. Mapped to < - Blank | Not Applicable - >.,Security vulnerability,Operational,Significant,Operations Team,28/12/2025,06/06/2025,< - Blank | Not Applicable - >,< - Blank | Not Applicable - >,
BR-F14,Business,Functional,Access Control & Authentication,Implement network access control (NAC) to ensure only authorized devices can connect to the OT network.,Under Review,Critical,32,2,144,162779,Initial,1,"Ad-hoc, no formal process",Future,Planned for future phases,0.6,Phase 1 (0-6 months),This access control & authentication supports regulatory compliance and operational security. Mapped to < - Blank | Not Applicable - >.,Regulatory exposure,Compliance,Severe,Security Team,07/07/2025,06/06/2025,< - Blank | Not Applicable - >,< - Blank | Not Applicable - >,
BR-F15,Business,Functional,Time Synchronisation & Management,Enable secure time synchronization across all segments of the OT network.,Completed,Medium,58,4,151,63014,Optimizing,5,Continuously improving,Essential,Critical for operations,1,Phase 2 (6-12 months),This time synchronisation & management supports regulatory compliance and operational security. Mapped to < - Blank | Not Applicable - >.,Regulatory exposure,Operational,Significant,Compliance Team,09/12/2025,06/06/2025,< - Blank | Not Applicable - >,< - Blank | Not Applicable - >,
BR-F16,Business,Functional,Network Architecture & Design,Implement micro-segmentation capabilities to further isolate critical assets within the OT network.,On Hold,High,13,4.1,219,307682,Initial,1,"Ad-hoc, no formal process",Future,Planned for future phases,0.6,Future (24+ months),This network architecture & design supports regulatory compliance and operational security. Mapped to < - Blank | Not Applicable - >.,Compliance gap,Compliance,Moderate,Security Team,10/02/2026,06/06/2025,< - Blank | Not Applicable - >,< - Blank | Not Applicable - >,
BR-F17,Business,Functional,Network Architecture & Design,Provide the ability to create and manage virtual LANs (VLANs) for logical segmentation within the OT network.,On Hold,Low,77,2.9,105,80188,Developing,2,Some processes defined,Essential,Critical for operations,1,Future (24+ months),This network architecture & design supports regulatory compliance and operational security. Mapped to < - Blank | Not Applicable - >.,Regulatory exposure,Compliance,Severe,Compliance Team,02/08/2025,06/06/2025,< - Blank | Not Applicable - >,< - Blank | Not Applicable - >,
BR-F18,Business,Functional,Integration Capabilities,Implement secure APIs for integrating segmentation controls with other security and management systems.,Under Review,Critical,16,2.1,224,493807,Optimizing,5,Continuously improving,Not Applicable,Not relevant to current scope,,Phase 2 (6-12 months),This integration capabilities supports regulatory compliance and operational security. Mapped to < - Blank | Not Applicable - >.,Operational risk,Compliance,Significant,Operations Team,03/09/2025,06/06/2025,< - Blank | Not Applicable - >,< - Blank | Not Applicable - >,
BR-F19,Business,Functional,Secure Data Flow,Enable the use of data diodes or unidirectional gateways where strict one-way communication is required.,Under Review,Critical,67,2.3,113,356005,Developing,2,Some processes defined,Not Applicable,Not relevant to current scope,,Future (24+ months),This secure data flow supports regulatory compliance and operational security. Mapped to < - Blank | Not Applicable - >.,Regulatory exposure,Compliance,Severe,Identity Team,20/06/2025,06/06/2025,< - Blank | Not Applicable - >,< - Blank | Not Applicable - >,
BR-F20,Business,Functional,Remote Management & Monitoring,Implement secure protocols for remote monitoring and management of OT devices across segmented networks.,On Hold,Medium,26,4.5,177,227815,Initial,1,"Ad-hoc, no formal process",Future,Planned for future phases,0.6,Phase 1 (0-6 months),This remote management & monitoring supports regulatory compliance and operational security. Mapped to < - Blank | Not Applicable - >.,Compliance gap,Security,Minor,Identity Team,17/07/2025,06/06/2025,< - Blank | Not Applicable - >,< - Blank | Not Applicable - >,
BR-F21,Business,Functional,Device & Firmware Management,Provide mechanisms for secure firmware updates across segmented OT networks.,In Progress,High,54,2,240,455966,Managed,4,Measured and controlled,Applicable,Relevant and beneficial,0.8,Phase 2 (6-12 months),This device & firmware management supports regulatory compliance and operational security. Mapped to < - Blank | Not Applicable - >.,Compliance gap,Operational,Moderate,Security Team,23/11/2025,06/06/2025,< - Blank | Not Applicable - >,< - Blank | Not Applicable - >,
BR-F22,Business,Functional,Monitoring & Detection,Implement network-based intrusion detection and prevention systems (IDS/IPS) tailored for OT environments.,Completed,Medium,10,4.9,218,378248,Initial,1,"Ad-hoc, no formal process",Conditional,Depends on other factors,0.4,Future (24+ months),This monitoring & detection supports regulatory compliance and operational security. Mapped to < - Blank | Not Applicable - >.,Operational risk,Security,Significant,Security Team,26/06/2025,06/06/2025,< - Blank | Not Applicable - >,< - Blank | Not Applicable - >,
BR-F23,Business,Functional,Integration Capabilities,Enable secure integration with existing identity and access management (IAM) systems.,Completed,Critical,36,1.7,98,481271,Initial,1,"Ad-hoc, no formal process",Future,Planned for future phases,0.6,Future (24+ months),This integration capabilities supports regulatory compliance and operational security. Mapped to < - Blank | Not Applicable - >.,Operational risk,Operational,Severe,Network Team,10/02/2026,06/06/2025,< - Blank | Not Applicable - >,< - Blank | Not Applicable - >,
BR-F24,Business,Functional,Integration Capabilities,Implement network segmentation-aware security information and event management (SIEM) capabilities.,On Hold,Critical,23,2.1,123,308806,Managed,4,Measured and controlled,Essential,Critical for operations,1,Future (24+ months),This integration capabilities supports regulatory compliance and operational security. Mapped to < - Blank | Not Applicable - >.,Compliance gap,Compliance,Severe,Identity Team,26/07/2025,06/06/2025,< - Blank | Not Applicable - >,< - Blank | Not Applicable - >,
BR-F25,Business,Functional,Device & Firmware Management,"Provide the ability to create and enforce network segmentation policies based on device type, function, and criticality.",Under Review,Low,92,4.9,41,517402,Initial,1,"Ad-hoc, no formal process",Applicable,Relevant and beneficial,0.8,Phase 1 (0-6 months),This device & firmware management supports regulatory compliance and operational security. Mapped to < - Blank | Not Applicable - >.,Regulatory exposure,Security,Moderate,Network Team,06/07/2025,06/06/2025,< - Blank | Not Applicable - >,< - Blank | Not Applicable - >,
BR-F26,Business,Functional,Integration Capabilities,Enable secure integration with industrial data historians and other OT-specific data repositories.,Under Review,High,15,3.6,186,344903,Developing,2,Some processes defined,Essential,Critical for operations,1,Phase 3 (12-24 months),This integration capabilities supports regulatory compliance and operational security. Mapped to < - Blank | Not Applicable - >.,Regulatory exposure,Operational,Moderate,Network Team,17/09/2025,06/06/2025,< - Blank | Not Applicable - >,< - Blank | Not Applicable - >,
BR-F27,Business,Functional,Secure Data Flow,Implement secure mechanisms for data exchange between different security zones or levels (as defined in ISA/IEC 62443).,Under Review,High,17,3.8,178,333718,Managed,4,Measured and controlled,Applicable,Relevant and beneficial,0.8,Phase 3 (12-24 months),This secure data flow supports regulatory compliance and operational security. Mapped to < - Blank | Not Applicable - >.,Security vulnerability,Operational,Significant,Network Team,03/12/2025,06/06/2025,< - Blank | Not Applicable - >,< - Blank | Not Applicable - >,
BR-F28,Business,Functional,Monitoring & Detection,Provide capabilities for network traffic analysis and anomaly detection specific to OT protocols and behaviors.,Not Started,Medium,33,3.5,143,115906,Managed,4,Measured and controlled,Conditional,Depends on other factors,0.4,Phase 2 (6-12 months),This monitoring & detection supports regulatory compliance and operational security. Mapped to < - Blank | Not Applicable - >.,Compliance gap,Operational,Moderate,Compliance Team,26/04/2026,06/06/2025,< - Blank | Not Applicable - >,< - Blank | Not Applicable - >,
BR-F29,Business,Functional,Data Exchange & External Integration,Enable secure integration with operational data analytics platforms while maintaining network segmentation.,Completed,Critical,92,3.1,260,55475,Optimizing,5,Continuously improving,Essential,Critical for operations,1,Phase 2 (6-12 months),This data exchange & external integration supports regulatory compliance and operational security. Mapped to < - Blank | Not Applicable - >.,Compliance gap,Financial,Minor,Network Team,02/06/2025,06/06/2025,< - Blank | Not Applicable - >,< - Blank | Not Applicable - >,
BR-F30,Business,Functional,Remote Access,Implement mechanisms for secure remote vendor access to specific OT network segments when required for support or maintenance.,Under Review,High,22,4.9,53,40045,Defined,3,Documented and standardized,Future,Planned for future phases,0.6,Future (24+ months),This remote access supports regulatory compliance and operational security. Mapped to < - Blank | Not Applicable - >.,Compliance gap,Operational,Significant,Operations Team,10/07/2025,06/06/2025,< - Blank | Not Applicable - >,< - Blank | Not Applicable - >,
BR-F31,Business,Functional,Integration Capabilities,Enable integration with industrial Internet of Things (IIoT) platforms while maintaining secure network segmentation.,Completed,Medium,62,2.6,56,45027,Managed,4,Measured and controlled,Future,Planned for future phases,0.6,Future (24+ months),This integration capabilities supports regulatory compliance and operational security. Mapped to < - Blank | Not Applicable - >.,Security vulnerability,Compliance,Minor,Identity Team,15/08/2025,06/06/2025,< - Blank | Not Applicable - >,< - Blank | Not Applicable - >,
BR-F32,Business,Functional,"Multi-site, Multi-tenant & Geographic Distribution",Provide capabilities for secure multi-site and multi-tenant OT network segmentation management.,In Progress,Medium,2,1.3,224,286195,Developing,2,Some processes defined,Future,Planned for future phases,0.6,Future (24+ months),"This multi-site, multi-tenant & geographic distribution supports regulatory compliance and operational security. Mapped to < - Blank | Not Applicable - >.",Compliance gap,Security,Minor,Network Team,19/06/2025,06/06/2025,< - Blank | Not Applicable - >,< - Blank | Not Applicable - >,
BR-F33,Business,Functional,Advanced Technologies,Implement AI-driven predictive analytics for anticipating potential segmentation breaches or policy conflicts.,Under Review,Medium,84,4.6,182,456464,Defined,3,Documented and standardized,Essential,Critical for operations,1,Phase 1 (0-6 months),This advanced technologies supports regulatory compliance and operational security. Mapped to < - Blank | Not Applicable - >.,Compliance gap,Compliance,Minor,Network Team,17/02/2026,06/06/2025,< - Blank | Not Applicable - >,< - Blank | Not Applicable - >,
BR-F34,Business,Functional,Advanced Technologies,Support dynamic segmentation that can automatically adjust based on threat intelligence and real-time risk assessments.,Completed,Critical,68,2.1,217,168912,Developing,2,Some processes defined,Not Applicable,Not relevant to current scope,,Phase 3 (12-24 months),This advanced technologies supports regulatory compliance and operational security. Mapped to < - Blank | Not Applicable - >.,Compliance gap,Compliance,Moderate,Identity Team,08/01/2026,06/06/2025,< - Blank | Not Applicable - >,< - Blank | Not Applicable - >,
BR-F35,Business,Functional,Integration Capabilities,Enable secure integration with emerging 5G and edge computing technologies in OT environments.,On Hold,Medium,47,3.5,134,423637,Initial,1,"Ad-hoc, no formal process",Applicable,Relevant and beneficial,0.8,Phase 2 (6-12 months),This integration capabilities supports regulatory compliance and operational security. Mapped to < - Blank | Not Applicable - >.,Compliance gap,Compliance,Severe,Identity Team,24/01/2026,06/06/2025,< - Blank | Not Applicable - >,< - Blank | Not Applicable - >,
BR-F36,Business,Functional,Data Exchange & External Integration,Provide mechanisms for secure data sharing and collaboration across segmented networks with partners and vendors.,Not Started,Medium,89,4.8,145,263140,Optimizing,5,Continuously improving,Conditional,Depends on other factors,0.4,Future (24+ months),This data exchange & external integration supports regulatory compliance and operational security. Mapped to < - Blank | Not Applicable - >.,Operational risk,Financial,Minor,Operations Team,27/03/2026,06/06/2025,< - Blank | Not Applicable - >,< - Blank | Not Applicable - >,
BR-F37,Business,Functional,Advanced Technologies,Implement blockchain or distributed ledger technology for immutable logging of segmentation policy changes and access attempts.,Not Started,Critical,83,4.3,78,313783,Defined,3,Documented and standardized,Essential,Critical for operations,1,Phase 1 (0-6 months),This advanced technologies supports regulatory compliance and operational security. Mapped to < - Blank | Not Applicable - >.,Regulatory exposure,Security,Significant,Security Team,25/05/2026,06/06/2025,< - Blank | Not Applicable - >,< - Blank | Not Applicable - >,
BR-F38,Business,Functional,Advanced Technologies,Support integration with digital twin technologies for simulating and testing segmentation strategies.,Not Started,Low,84,3.6,159,27737,Defined,3,Documented and standardized,Conditional,Depends on other factors,0.4,Future (24+ months),This advanced technologies supports regulatory compliance and operational security. Mapped to < - Blank | Not Applicable - >.,Compliance gap,Operational,Moderate,Compliance Team,24/10/2025,06/06/2025,< - Blank | Not Applicable - >,< - Blank | Not Applicable - >,
BR-F39,Business,Functional,"Multi-site, Multi-tenant & Geographic Distribution",Enable seamless segmentation across hybrid cloud-OT environments.,On Hold,Critical,60,2.9,220,53727,Developing,2,Some processes defined,Future,Planned for future phases,0.6,Phase 2 (6-12 months),"This multi-site, multi-tenant & geographic distribution supports regulatory compliance and operational security. Mapped to < - Blank | Not Applicable - >.",Compliance gap,Financial,Severe,Compliance Team,02/10/2025,06/06/2025,< - Blank | Not Applicable - >,< - Blank | Not Applicable - >,
BR-F40,Business,Functional,Advanced Technologies,Provide capabilities for segmenting and securing operational data used in machine learning and AI applications within OT environments.,Completed,Low,78,2.3,90,165051,Managed,4,Measured and controlled,Conditional,Depends on other factors,0.4,Phase 2 (6-12 months),This advanced technologies supports regulatory compliance and operational security. Mapped to < - Blank | Not Applicable - >.,Operational risk,Operational,Moderate,Security Team,16/02/2026,06/06/2025,< - Blank | Not Applicable - >,< - Blank | Not Applicable - >,
BR-NF1,Business,Non-Functional,Compliance & Regulatory Management,"Ensure that the network segmentation solution complies with relevant industry standards and regulations for OT security (e.g., IEC 62443, NIST SP 800-82).",In Progress,Medium,7,3.8,94,286615,Developing,2,Some processes defined,Essential,Critical for operations,1,Phase 1 (0-6 months),This compliance & regulatory management supports regulatory compliance and operational security. Mapped to A1: Governance. Addresses NIS Regulation 10(1) - Compliance with industry standards.,Operational risk,Operational,Severe,Network Team,25/08/2025,06/06/2025,A1: Governance,A2: Risk management,NIS Regulation 10(1) - Compliance with industry standards
BR-NF2,Business,Non-Functional,Operational Continuity & Minimal Disruption,"Minimize impact on existing OT operations and processes while implementing security measures, ensuring no disruption to critical operations.",On Hold,High,31,3.3,207,446008,Optimizing,5,Continuously improving,Applicable,Relevant and beneficial,0.8,Phase 3 (12-24 months),This operational continuity & minimal disruption supports regulatory compliance and operational security. Mapped to < - Blank | Not Applicable - >. Addresses NIS Regulation 10(2)(e) - Ongoing verification and assessment.,Operational risk,Security,Severe,Identity Team,24/08/2025,06/06/2025,< - Blank | Not Applicable - >,< - Blank | Not Applicable - >,NIS Regulation 10(2)(e) - Ongoing verification and assessment
BR-NF3,Business,Non-Functional,Performance & Scalability,Provide scalability to accommodate future growth and changes in the OT environment for at least the next 5 years.,Not Started,Low,62,4.3,28,241125,Optimizing,5,Continuously improving,Applicable,Relevant and beneficial,0.8,Phase 1 (0-6 months),This performance & scalability supports regulatory compliance and operational security. Mapped to < - Blank | Not Applicable - >.,Security vulnerability,Financial,Severe,Operations Team,28/01/2026,06/06/2025,< - Blank | Not Applicable - >,< - Blank | Not Applicable - >,
