id,area,type,category,description,status,priority,progress,businessValueScore,roiProjection,costEstimate,maturityLevel_level,maturityLevel_score,maturityLevel_description,applicability_type,applicability_description,applicability_weight,implementationPhase,businessJustification,consequences_immediate,consequences_type,consequences_impact,assignee,dueDate,lastUpdated,cafPrinciple,cafPrinciple2,nisReference
UR-F13,User,Functional,Troubleshooting & Maintenance,IT support staff shall be able to troubleshoot connectivity issues across segmented networks.,Completed,Critical,18,4.8,68,346552,Managed,4,Measured and controlled,Not Applicable,Not relevant to current scope,,Future (24+ months),This troubleshooting & maintenance supports regulatory compliance and operational security. Mapped to < - Blank | Not Applicable - >.,Operational risk,Operational,Moderate,Network Team,17/01/2026,06/06/2025,< - Blank | Not Applicable - >,< - Blank | Not Applicable - >,
UR-F14,User,Functional,Testing & Simulation,OT security personnel shall be able to simulate and test network segmentation policies before deployment.,Not Started,High,19,4.1,251,104442,Initial,1,"Ad-hoc, no formal process",Applicable,Relevant and beneficial,0.8,Phase 2 (6-12 months),This testing & simulation supports regulatory compliance and operational security. Mapped to < - Blank | Not Applicable - >.,Operational risk,Compliance,Significant,Operations Team,28/11/2025,06/06/2025,< - Blank | Not Applicable - >,< - Blank | Not Applicable - >,
UR-F15,User,Functional,Visualization & User Interface,Plant managers shall be able to view the operational status of critical OT systems across different network segments.,In Progress,High,34,1,208,440536,Developing,2,Some processes defined,Conditional,Depends on other factors,0.4,Phase 3 (12-24 months),This visualization & user interface supports regulatory compliance and operational security. Mapped to < - Blank | Not Applicable - >.,Compliance gap,Financial,Severe,Security Team,27/12/2025,06/06/2025,< - Blank | Not Applicable - >,< - Blank | Not Applicable - >,
UR-F16,User,Functional,Configuration & Change Management,Administrators shall be able to manage and update firewall rules between network segments.,Not Started,Low,9,1.3,180,413565,Defined,3,Documented and standardized,Not Applicable,Not relevant to current scope,,Future (24+ months),This configuration & change management supports regulatory compliance and operational security. Mapped to < - Blank | Not Applicable - >.,Security vulnerability,Operational,Significant,Operations Team,22/12/2025,06/06/2025,< - Blank | Not Applicable - >,< - Blank | Not Applicable - >,
UR-F17,User,Functional,Security Assessment & Vulnerability Management,Security teams shall be able to conduct vulnerability scans on specific network segments without affecting others.,On Hold,High,18,4,25,346621,Defined,3,Documented and standardized,Applicable,Relevant and beneficial,0.8,Phase 1 (0-6 months),This security assessment & vulnerability management supports regulatory compliance and operational security. Mapped to < - Blank | Not Applicable - >.,Security vulnerability,Financial,Significant,Network Team,13/04/2026,06/06/2025,< - Blank | Not Applicable - >,< - Blank | Not Applicable - >,
UR-F18,User,Functional,Secure Data Flow,OT engineers shall be able to securely transfer data between different security zones when necessary.,Not Started,Medium,46,2.3,39,454241,Defined,3,Documented and standardized,Not Applicable,Not relevant to current scope,,Phase 2 (6-12 months),This secure data flow supports regulatory compliance and operational security. Mapped to < - Blank | Not Applicable - >.,Regulatory exposure,Operational,Minor,Compliance Team,11/03/2026,06/06/2025,< - Blank | Not Applicable - >,< - Blank | Not Applicable - >,
UR-F19,User,Functional,Incident Response,Network operators shall be able to quickly isolate a compromised network segment in case of a security incident.,Completed,Medium,6,1.8,264,254901,Developing,2,Some processes defined,Not Applicable,Not relevant to current scope,,Future (24+ months),This incident response supports regulatory compliance and operational security. Mapped to < - Blank | Not Applicable - >.,Compliance gap,Security,Moderate,Network Team,02/02/2026,06/06/2025,< - Blank | Not Applicable - >,< - Blank | Not Applicable - >,
UR-F20,User,Functional,Time Synchronisation & Management,Administrators shall be able to manage and synchronize time across all network segments.,Under Review,Critical,84,4.2,266,409573,Developing,2,Some processes defined,Not Applicable,Not relevant to current scope,,Phase 1 (0-6 months),This time synchronisation & management supports regulatory compliance and operational security. Mapped to < - Blank | Not Applicable - >.,Compliance gap,Operational,Moderate,Operations Team,21/04/2026,06/06/2025,< - Blank | Not Applicable - >,< - Blank | Not Applicable - >,
UR-F21,User,Functional,Training & Knowledge Management,The system shall provide an interactive tutorial or walkthrough for new users to learn basic network segmentation management tasks.,In Progress,High,62,2.8,137,504012,Optimizing,5,Continuously improving,Future,Planned for future phases,0.6,Future (24+ months),This training & knowledge management supports regulatory compliance and operational security. Mapped to < - Blank | Not Applicable - >.,Regulatory exposure,Operational,Moderate,Identity Team,05/03/2026,06/06/2025,< - Blank | Not Applicable - >,< - Blank | Not Applicable - >,
UR-F22,User,Functional,Training & Knowledge Management,Users shall be able to access a knowledge base of best practices and common issues related to OT network segmentation.,Not Started,Low,90,1.5,87,115290,Defined,3,Documented and standardized,Essential,Critical for operations,1,Future (24+ months),This training & knowledge management supports regulatory compliance and operational security. Mapped to < - Blank | Not Applicable - >.,Regulatory exposure,Operational,Significant,Compliance Team,02/10/2025,06/06/2025,< - Blank | Not Applicable - >,< - Blank | Not Applicable - >,
UR-F23,User,Functional,Configuration & Change Management / Backup & Recovery,Administrators shall be able to create and restore backups of network segmentation configurations.,Not Started,High,31,3.6,229,423139,Developing,2,Some processes defined,Applicable,Relevant and beneficial,0.8,Future (24+ months),This configuration & change management / backup & recovery supports regulatory compliance and operational security. Mapped to < - Blank | Not Applicable - >.,Operational risk,Financial,Moderate,Identity Team,13/11/2025,06/06/2025,< - Blank | Not Applicable - >,< - Blank | Not Applicable - >,
UR-F24,User,Functional,Configuration & Change Management,The system shall provide a change management workflow for approving and implementing significant changes to network segmentation.,Completed,Medium,27,2.1,141,155486,Optimizing,5,Continuously improving,Not Applicable,Not relevant to current scope,,Phase 1 (0-6 months),This configuration & change management supports regulatory compliance and operational security. Mapped to < - Blank | Not Applicable - >.,Operational risk,Security,Severe,Identity Team,13/01/2026,06/06/2025,< - Blank | Not Applicable - >,< - Blank | Not Applicable - >,
UR-F25,User,Functional,Remote Management & Monitoring,"Administrators shall be able to view performance metrics of segmentation devices (e.g., firewalls, switches) and receive alerts when thresholds are exceeded.",On Hold,Medium,8,3.5,142,301350,Managed,4,Measured and controlled,Future,Planned for future phases,0.6,Phase 1 (0-6 months),This remote management & monitoring supports regulatory compliance and operational security. Mapped to < - Blank | Not Applicable - >.,Operational risk,Operational,Severe,Security Team,03/01/2026,06/06/2025,< - Blank | Not Applicable - >,< - Blank | Not Applicable - >,
UR-F26,User,Functional,Incident Response,Security teams shall be able to quickly implement pre-defined incident response plans that adjust network segmentation during a security event.,On Hold,Medium,35,2.2,146,110134,Managed,4,Measured and controlled,Future,Planned for future phases,0.6,Phase 1 (0-6 months),This incident response supports regulatory compliance and operational security. Mapped to < - Blank | Not Applicable - >.,Security vulnerability,Security,Significant,Operations Team,20/11/2025,06/06/2025,< - Blank | Not Applicable - >,< - Blank | Not Applicable - >,
UR-F27,User,Functional,Compliance & Regulatory Management,"The system shall allow users to generate compliance reports for various industry standards (e.g., IEC 62443, NIST) based on current network segmentation configuration.",Completed,Low,60,4.1,55,271191,Optimizing,5,Continuously improving,Conditional,Depends on other factors,0.4,Future (24+ months),This compliance & regulatory management supports regulatory compliance and operational security. Mapped to A1: Governance. Addresses NIS Regulation 10(2)(e) - Regular testing and assessment.,Regulatory exposure,Financial,Moderate,Operations Team,06/11/2025,06/06/2025,A1: Governance,< - Blank | Not Applicable - >,NIS Regulation 10(2)(e) - Regular testing and assessment
UR-F28,User,Functional,Integration Capabilities,The system shall integrate with existing asset management systems to automatically assign new devices to appropriate network segments based on their type and function.,Under Review,Medium,49,2.3,87,403321,Managed,4,Measured and controlled,Not Applicable,Not relevant to current scope,,Phase 1 (0-6 months),This integration capabilities supports regulatory compliance and operational security. Mapped to < - Blank | Not Applicable - >.,Compliance gap,Operational,Significant,Network Team,03/02/2026,06/06/2025,< - Blank | Not Applicable - >,< - Blank | Not Applicable - >,
UR-F29,User,Functional,Testing & Simulation,Engineers shall be able to use a sandbox environment to test changes to network segmentation without affecting the production environment.,Completed,High,4,1.7,168,281873,Defined,3,Documented and standardized,Essential,Critical for operations,1,Future (24+ months),This testing & simulation supports regulatory compliance and operational security. Mapped to < - Blank | Not Applicable - >.,Regulatory exposure,Security,Significant,Compliance Team,26/03/2026,06/06/2025,< - Blank | Not Applicable - >,< - Blank | Not Applicable - >,
UR-F30,User,Functional,Integration Capabilities,Developers and system integrators shall be able to use APIs to automate network segmentation tasks and integrate with other systems.,In Progress,High,2,3.7,34,169763,Managed,4,Measured and controlled,Essential,Critical for operations,1,Phase 2 (6-12 months),This integration capabilities supports regulatory compliance and operational security. Mapped to < - Blank | Not Applicable - >.,Compliance gap,Compliance,Severe,Identity Team,09/01/2026,06/06/2025,< - Blank | Not Applicable - >,< - Blank | Not Applicable - >,
UR-F31,User,Functional,Compliance & Regulatory Management,The system shall notify administrators of relevant regulatory changes that may impact network segmentation requirements.,Under Review,High,66,2.9,222,387501,Defined,3,Documented and standardized,Not Applicable,Not relevant to current scope,,Phase 1 (0-6 months),This compliance & regulatory management supports regulatory compliance and operational security. Mapped to A1: Governance. Addresses NIS Regulation 10(1) - Ongoing compliance.,Regulatory exposure,Compliance,Minor,Operations Team,16/05/2026,06/06/2025,A1: Governance,A2: Risk management,NIS Regulation 10(1) - Ongoing compliance
UR-F32,User,Functional,Visualization & User Interface,Users shall be able to customize their dashboard views and save multiple layouts based on their specific roles and preferences.,In Progress,High,61,3,182,420180,Initial,1,"Ad-hoc, no formal process",Future,Planned for future phases,0.6,Future (24+ months),This visualization & user interface supports regulatory compliance and operational security. Mapped to < - Blank | Not Applicable - >.,Security vulnerability,Financial,Minor,Security Team,07/11/2025,06/06/2025,< - Blank | Not Applicable - >,< - Blank | Not Applicable - >,
UR-F33,User,Functional,Configuration & Change Management,The system shall support collaborative workflows allowing multiple users to work on segmentation policies simultaneously with version control.,Completed,Critical,28,4.7,144,375185,Optimizing,5,Continuously improving,Applicable,Relevant and beneficial,0.8,Phase 2 (6-12 months),This configuration & change management supports regulatory compliance and operational security. Mapped to < - Blank | Not Applicable - >.,Compliance gap,Financial,Moderate,Identity Team,26/11/2025,06/06/2025,< - Blank | Not Applicable - >,< - Blank | Not Applicable - >,
UR-F34,User,Functional,Advanced Technologies,The system shall provide a natural language interface for users to query network segmentation status and policies.,In Progress,Low,93,1.7,81,359392,Defined,3,Documented and standardized,Not Applicable,Not relevant to current scope,,Phase 3 (12-24 months),This advanced technologies supports regulatory compliance and operational security. Mapped to < - Blank | Not Applicable - >.,Compliance gap,Compliance,Minor,Identity Team,01/04/2026,06/06/2025,< - Blank | Not Applicable - >,< - Blank | Not Applicable - >,
UR-F35,User,Functional,Visualization & User Interface,OT engineers shall be able to use augmented reality devices to visualize network segmentation overlays in physical plant environments.,In Progress,Medium,9,1.8,30,69753,Managed,4,Measured and controlled,Not Applicable,Not relevant to current scope,,Future (24+ months),This visualization & user interface supports regulatory compliance and operational security. Mapped to < - Blank | Not Applicable - >.,Compliance gap,Security,Minor,Identity Team,25/05/2026,06/06/2025,< - Blank | Not Applicable - >,< - Blank | Not Applicable - >,
UR-F36,User,Functional,Offline Operations,"Users shall be able to access critical segmentation information and perform basic tasks in an offline mode, with synchronization upon reconnection.",On Hold,Medium,33,3.7,39,77389,Managed,4,Measured and controlled,Conditional,Depends on other factors,0.4,Phase 1 (0-6 months),This offline operations supports regulatory compliance and operational security. Mapped to < - Blank | Not Applicable - >.,Security vulnerability,Compliance,Moderate,Network Team,21/01/2026,06/06/2025,< - Blank | Not Applicable - >,< - Blank | Not Applicable - >,
UR-F37,User,Functional,Advanced Technologies,The system shall analyze user behavior patterns to detect anomalies and potential security risks in segmentation management activities.,On Hold,Low,1,3.8,264,341837,Managed,4,Measured and controlled,Essential,Critical for operations,1,Phase 3 (12-24 months),This advanced technologies supports regulatory compliance and operational security. Mapped to < - Blank | Not Applicable - >.,Operational risk,Security,Severe,Network Team,31/05/2025,06/06/2025,< - Blank | Not Applicable - >,< - Blank | Not Applicable - >,
UR-F38,User,Functional,Training & Knowledge Management,The system shall incorporate gamification elements in its training modules to enhance user engagement and learning of segmentation concepts.,On Hold,Low,29,4.4,124,71454,Defined,3,Documented and standardized,Conditional,Depends on other factors,0.4,Phase 1 (0-6 months),This training & knowledge management supports regulatory compliance and operational security. Mapped to < - Blank | Not Applicable - >.,Operational risk,Compliance,Minor,Network Team,11/01/2026,06/06/2025,< - Blank | Not Applicable - >,< - Blank | Not Applicable - >,
UR-F39,User,Functional,Advanced Technologies,Users shall have access to an AI-powered virtual assistant to help with common tasks and troubleshooting related to network segmentation.,Under Review,High,81,4.6,255,171868,Optimizing,5,Continuously improving,Essential,Critical for operations,1,Phase 3 (12-24 months),This advanced technologies supports regulatory compliance and operational security. Mapped to < - Blank | Not Applicable - >.,Operational risk,Financial,Severe,Network Team,02/09/2025,06/06/2025,< - Blank | Not Applicable - >,< - Blank | Not Applicable - >,
UR-F40,User,Functional,Remote Management & Monitoring,The system shall provide predictive maintenance alerts for segmentation devices based on performance metrics and historical data.,On Hold,Medium,68,3.1,228,143700,Developing,2,Some processes defined,Not Applicable,Not relevant to current scope,,Phase 1 (0-6 months),This remote management & monitoring supports regulatory compliance and operational security. Mapped to < - Blank | Not Applicable - >.,Compliance gap,Operational,Severe,Security Team,12/09/2025,06/06/2025,< - Blank | Not Applicable - >,< - Blank | Not Applicable - >,
UR-F41,User,Functional,Voice & Alternative Interfaces,Users shall be able to perform basic monitoring and control tasks using voice commands in environments where hands-free operation is beneficial.,Under Review,High,6,3.7,138,392720,Initial,1,"Ad-hoc, no formal process",Applicable,Relevant and beneficial,0.8,Future (24+ months),This voice & alternative interfaces supports regulatory compliance and operational security. Mapped to < - Blank | Not Applicable - >.,Compliance gap,Financial,Moderate,Security Team,03/03/2026,06/06/2025,< - Blank | Not Applicable - >,< - Blank | Not Applicable - >,
UR-F42,User,Functional,Training & Knowledge Management,The system shall provide context-sensitive help and guidance based on the user's current task and historical usage patterns.,Not Started,High,45,4,210,229467,Optimizing,5,Continuously improving,Essential,Critical for operations,1,Phase 3 (12-24 months),This training & knowledge management supports regulatory compliance and operational security. Mapped to < - Blank | Not Applicable - >.,Security vulnerability,Operational,Moderate,Operations Team,01/10/2025,06/06/2025,< - Blank | Not Applicable - >,< - Blank | Not Applicable - >,
UR-F43,User,Functional,Feedback & Continuous Improvement,"Users shall be able to provide in-app feedback on features and suggest improvements, with a visible feedback loop on the status of their suggestions.",In Progress,Medium,86,4.7,193,217809,Optimizing,5,Continuously improving,Essential,Critical for operations,1,Phase 1 (0-6 months),This feedback & continuous improvement supports regulatory compliance and operational security. Mapped to < - Blank | Not Applicable - >.,Compliance gap,Financial,Significant,Compliance Team,24/06/2025,06/06/2025,< - Blank | Not Applicable - >,< - Blank | Not Applicable - >,
UR-F44,User,Functional,Training & Knowledge Management,The system shall provide integrated learning paths for users to develop skills across IT and OT domains relevant to network segmentation.,In Progress,High,73,4.9,141,66395,Developing,2,Some processes defined,Not Applicable,Not relevant to current scope,,Phase 1 (0-6 months),This training & knowledge management supports regulatory compliance and operational security. Mapped to < - Blank | Not Applicable - >.,Compliance gap,Security,Severe,Compliance Team,27/10/2025,06/06/2025,< - Blank | Not Applicable - >,< - Blank | Not Applicable - >,
UR-NF1,User,Non-Functional,Visualisation & User Interface,The user interface for managing network segmentation shall be intuitive and require minimal training for IT/OT staff.,On Hold,Medium,62,1.9,93,287342,Initial,1,"Ad-hoc, no formal process",Conditional,Depends on other factors,0.4,Phase 2 (6-12 months),This visualisation & user interface supports regulatory compliance and operational security. Mapped to < - Blank | Not Applicable - >.,Operational risk,Security,Severe,Security Team,02/07/2025,06/06/2025,< - Blank | Not Applicable - >,< - Blank | Not Applicable - >,
UR-NF2,User,Non-Functional,Access Control & Authentication,The system shall authenticate users before granting access to segmentation management functions.,Under Review,Critical,89,2.8,88,258457,Optimizing,5,Continuously improving,Not Applicable,Not relevant to current scope,,Phase 2 (6-12 months),This access control & authentication supports regulatory compliance and operational security. Mapped to < - Blank | Not Applicable - >.,Regulatory exposure,Compliance,Significant,Compliance Team,11/10/2025,06/06/2025,< - Blank | Not Applicable - >,< - Blank | Not Applicable - >,
UR-NF3,User,Non-Functional,Access Control & Authentication,"The system shall provide role-based access control for different user types (e.g., administrators, operators, auditors).",Not Started,High,31,3.7,263,293960,Managed,4,Measured and controlled,Future,Planned for future phases,0.6,Phase 2 (6-12 months),This access control & authentication supports regulatory compliance and operational security. Mapped to < - Blank | Not Applicable - >.,Operational risk,Operational,Moderate,Network Team,18/09/2025,06/06/2025,< - Blank | Not Applicable - >,< - Blank | Not Applicable - >,
UR-NF4,User,Non-Functional,Visualization & User Interface,The system shall respond to user interactions within 2 seconds under normal operating conditions.,Under Review,Low,37,1.3,253,140898,Managed,4,Measured and controlled,Future,Planned for future phases,0.6,Phase 1 (0-6 months),This visualization & user interface supports regulatory compliance and operational security. Mapped to < - Blank | Not Applicable - >.,Security vulnerability,Operational,Significant,Operations Team,11/04/2026,06/06/2025,< - Blank | Not Applicable - >,< - Blank | Not Applicable - >,
UR-NF5,User,Non-Functional,Multi-Platform Access,"The user interface shall be accessible from both IT and OT networks, with appropriate security controls.",Completed,Critical,93,3.8,131,283803,Managed,4,Measured and controlled,Essential,Critical for operations,1,Future (24+ months),This multi-platform access supports regulatory compliance and operational security. Mapped to < - Blank | Not Applicable - >.,Regulatory exposure,Compliance,Significant,Security Team,20/11/2025,06/06/2025,< - Blank | Not Applicable - >,< - Blank | Not Applicable - >,
UR-NF6,User,Non-Functional,Concurrent Usage & Performance,The system shall support concurrent access by multiple users without degradation in performance.,Under Review,Critical,8,3.7,99,479756,Initial,1,"Ad-hoc, no formal process",Essential,Critical for operations,1,Phase 3 (12-24 months),This concurrent usage & performance supports regulatory compliance and operational security. Mapped to < - Blank | Not Applicable - >.,Operational risk,Operational,Significant,Security Team,15/12/2025,06/06/2025,< - Blank | Not Applicable - >,< - Blank | Not Applicable - >,
UR-NF7,User,Non-Functional,Visualisation & User Interface,The user interface shall be compatible with standard web browsers and not require special software installation.,On Hold,Critical,80,1.5,243,415736,Initial,1,"Ad-hoc, no formal process",Essential,Critical for operations,1,Phase 2 (6-12 months),This visualisation & user interface supports regulatory compliance and operational security. Mapped to < - Blank | Not Applicable - >.,Regulatory exposure,Financial,Severe,Security Team,03/03/2026,06/06/2025,< - Blank | Not Applicable - >,< - Blank | Not Applicable - >,
UR-NF8,User,Non-Functional,Usability & Accessibility,"The system shall provide clear, actionable error messages to users when issues occur.",Completed,Medium,17,4.4,67,89430,Developing,2,Some processes defined,Essential,Critical for operations,1,Phase 2 (6-12 months),This usability & accessibility supports regulatory compliance and operational security. Mapped to < - Blank | Not Applicable - >.,Operational risk,Security,Minor,Security Team,18/09/2025,06/06/2025,< - Blank | Not Applicable - >,< - Blank | Not Applicable - >,
UR-NF9,User,Non-Functional,Auditability & Traceability,The system shall maintain an audit log of all user actions related to network segmentation changes.,Under Review,High,89,3.2,135,144342,Optimizing,5,Continuously improving,Applicable,Relevant and beneficial,0.8,Phase 3 (12-24 months),This auditability & traceability supports regulatory compliance and operational security. Mapped to < - Blank | Not Applicable - >.,Regulatory exposure,Operational,Significant,Security Team,16/04/2026,06/06/2025,< - Blank | Not Applicable - >,< - Blank | Not Applicable - >,
UR-NF10,User,Non-Functional,Internationalisation & Localisation,The user interface shall be available in multiple languages to support a diverse workforce.,Completed,Medium,45,4.8,267,192114,Defined,3,Documented and standardized,Not Applicable,Not relevant to current scope,,Phase 1 (0-6 months),This internationalisation & localisation supports regulatory compliance and operational security. Mapped to < - Blank | Not Applicable - >.,Security vulnerability,Financial,Severe,Network Team,06/11/2025,06/06/2025,< - Blank | Not Applicable - >,< - Blank | Not Applicable - >,
UR-NF11,User,Non-Functional,Training & Knowledge Management,The system shall provide context-sensitive help and documentation accessible from the user interface.,Not Started,Critical,88,3.5,152,446956,Defined,3,Documented and standardized,Applicable,Relevant and beneficial,0.8,Phase 1 (0-6 months),This training & knowledge management supports regulatory compliance and operational security. Mapped to < - Blank | Not Applicable - >.,Operational risk,Financial,Significant,Security Team,06/02/2026,06/06/2025,< - Blank | Not Applicable - >,< - Blank | Not Applicable - >,
